{
  "schemaVersion": 1,
  "paperName": "elf_embedded_language_flows",
  "title": "ELF: Embedded Language Flows",
  "authors": [],
  "year": null,
  "venue": "",
  "paperUrl": "https://arxiv.org/abs/2605.10938",
  "participants": [
    {
      "name": "liuyuxuan",
      "github": "happycodingday"
    }
  ],
  "topics": [],
  "skillVersion": "1.0.0",
  "status": "published",
  "entry": "index.html"
}
